{
  "schema": 1,
  "name": "Tip Splitter",
  "platforms": [
    "web"
  ],
  "tokens": {
    "shared": [
      "tokens/base.json"
    ],
    "modes": {
      "light": [
        "tokens/light.json"
      ],
      "dark": [
        "tokens/dark.json"
      ]
    }
  },
  "defaultMode": "light",
  "assumed": [],
  "components": "components.json",
  "voice": "voice.md"
}
